{
  "walls": [
    {
      "id": "wall-1",
      "start": [
        0,
        0
      ],
      "end": [
        100,
        0
      ],
      "thickness": 0.25,
      "type": "exterior"
    },
    {
      "id": "wall-2",
      "start": [
        100,
        0
      ],
      "end": [
        100,
        80
      ],
      "thickness": 0.25,
      "type": "exterior"
    },
    {
      "id": "wall-3",
      "start": [
        100,
        80
      ],
      "end": [
        0,
        80
      ],
      "thickness": 0.25,
      "type": "exterior"
    },
    {
      "id": "wall-4",
      "start": [
        0,
        80
      ],
      "end": [
        0,
        0
      ],
      "thickness": 0.25,
      "type": "exterior"
    },
    {
      "id": "wall-5",
      "start": [
        40,
        0
      ],
      "end": [
        40,
        30
      ],
      "thickness": 0.15,
      "type": "interior"
    },
    {
      "id": "wall-6",
      "start": [
        40,
        30
      ],
      "end": [
        60,
        30
      ],
      "thickness": 0.15,
      "type": "interior"
    },
    {
      "id": "wall-7",
      "start": [
        60,
        30
      ],
      "end": [
        60,
        0
      ],
      "thickness": 0.15,
      "type": "interior"
    }
  ],
  "rooms": [
    {
      "id": "room-1",
      "polygon": [
        [
          0,
          0
        ],
        [
          100,
          0
        ],
        [
          100,
          80
        ],
        [
          0,
          80
        ]
      ],
      "area_m2": 80
    },
    {
      "id": "room-2",
      "polygon": [
        [
          40,
          0
        ],
        [
          60,
          0
        ],
        [
          60,
          30
        ],
        [
          40,
          30
        ]
      ],
      "area_m2": 6
    }
  ],
  "openings": [
    {
      "id": "opening-1",
      "wallId": "wall-1",
      "type": "door",
      "position": 0.5
    }
  ],
  "meta": {
    "scale": 0.01,
    "bounds": {
      "minX": 0,
      "maxX": 100,
      "minY": 0,
      "maxY": 80
    }
  }
}